{
  "kind": "levibe.edit_proposal.v1",
  "proposals": [
    {
      "targetUri": "file:///workspace/golden/patch.ts",
      "edit": {
        "kind": "range_replace",
        "range": {
          "start": { "line": 1, "character": 0 },
          "end": { "line": 1, "character": 5 }
        },
        "newText": "const"
      }
    }
  ],
  "rationale": "Golden regression: range replace preserves surrounding lines.",
  "confidence": { "score": 0.88, "flags": ["uncertain_api"] }
}
